text,emotions
фукуоктан астанаға ұшатын тікелей рейстер ашылады көлік министрлігі ұшу географиясын кеңейту және халықаралық рейстер санын ұлғайту бойынша жұмысты жалғастыруда нәтижесінде фукуок астана бағыты бойынша рейстер ашылады деп хабарлайды азаматтық авиация комитеті telegram дағы арнасында комитет ақпаратынша vietjet air вьетнамдық әуекомпаниясы жылдардың күзгіқысқы навигациясынан бастап а типті әуе кемелерінде аптасына рейс жиілігімен сәрсенбі және сенбі фукуок астана бағыты бойынша тікелей тұрақты жолаушылар рейстерін ашуды жоспарлап отыр қазақстан мен вьетнам арасындағы әуе қатынасының ашылуы елдер арасындағы саудаэкономикалық инвестициялық туристік және мәдени ынтымақтастықты одан әрі дамытуға ықпал ететін болады еске салсақ бұған дейін air astana алматы фукуок алматы бағыты бойынша тікелей рейстердің ашылып ұшу желісінің кеңейгенін хабарлаған болатын сонымен қатар қазақстаннан оңтүстік шығыс азия елдеріне тікелей рейстер ашылды,"""['қуаныш', 'таңқалу']"""
қазақстаннан оңтүстік шығыс азия елдеріне тікелей рейстер ашылды scat әуекомпаниясы оңтүстік шығыс азия елдеріне тікелей рейстерді іске қосады бұл туралы азаматтық авиация комитеті telegram дағы арнасында хабарлады комитет ақпаратынша биыл қазаннан бастап scat қазақстандық әуе компаниясы астана сиануквиль және алматы сиануквиль бағыттары бойынша камбоджаға тікелей жолаушылар рейстерін іске қосады қазанда астанадан алғашқы рейс орындалды алматыдан алғашқы ұшу қазанда жоспарланған туристерге ыңғайлы болу үшін рейстер чартерлік негізде boeing max әк типінде орындалады,"""['қуаныш', 'таңқалу', 'уайым']"""
талғарда изолятордан қашып кеткен күдіктінің ұсталған сәтінен видео жарияланды желіде бірнеше күн бұрын талғардағы уақытша ұстау изоляторынан қашып кеткен күдіктіні ұстау сәтінің видеосы тарап жатыр бұл туралы kaznurkz хабарлайды зорлау бойынша күдіктіні ұстау сәтінің видеосы instagram дағы ztbkz парақшасында жарияланған видео сипаттамасында қашқынды ұстауға алматы облысының тұрғындары көмектескені туралы айтылған еске салайық бұған дейін алматы облысының полиция департаменті талғардағы уақытша ұстау изоляторынан қашып кеткен зорлау бойынша күдіктінің жеке мәліметтерін жариялағанын хабарлаған едік алматы облысы полиция департаменті уақытша ұстау изоляторынан қашып кеткен жылы туылған бекарыс сәбитұлы қалмырзаевқа іздеу салды ал бүгін талғардағы уақытша ұстау изоляторынан қашып кеткен күдікті ұсталғаны хабарланды,"""['уайым', 'уайым', 'таңқалу']"""
жылғы қазан криптовалюталардың долларға шаққандағы бағамы binance блокчейнэкожүйесінің ақпаратына сәйкес криптовалюта нарығындағы жылғы қазан күнгі жағдай мынадай биткоиннің долларға шаққандағы бағамы өткен тәулік ішінде ға өсті бүгін актив төңірегінде саудаланады tronix криптовалютасы бүгін кешегі күнмен салыстырғанда ға өсті trx бағамы жылғы қазан күні ды құрап отыр ethereumнің долларға шаққандағы бағамы ға төмендеді аталған криптовалютаның құны бүгінде ды құрап отыр decentraland криптовалютасы тәулік ішінде ға арзандады қазіргі уақытта актив деңгейінде саудаланып жатыр true usd тәулік ішінде ға төмендеді tusd бағамы жылғы қазан күні ды құрап отыр litecoin криптовалютасы ға нығая түсті актив деңгейінде саудаланып жатыр ethereum classic бағасы бүгінде ға төмендеді криптовалютаның өзекті құны ripple өткен күнмен салыстырғанда ға арзандады криптовалютаның бүгінгі құны dogecoin кешегі күнмен салыстырғанда ға арзандады қазіргі уақытта актив деңгейінде саудаланып жатыр материал binance криптовалюталық биржасының деректері негізінде әзірленген бағамдарға қатысты ақпарат мақала жарияланған сәтте өзекті,"""['уайым', 'таңқалу']"""
тоқаев мемлекеттік ту көтеру рәсіміне қатысты мемлекет басшысы қасымжомарт тоқаев ұлық мереке республика күніне арналған мемлекеттік ту көтеру салтанатты рәсіміне қатысты ісшара ақорда резиденциясының алдында өтті деп хабарлайды президенттің баспасөз қызметі құрмет қарауылының бастығы президентке рапорт берді бұдан кейін қасымжомарт тоқаевтың бұйрығымен мемлекеттік ту көтеріліп әнұранымыз шырқалды баршаға белгілі мемлекет басшысы республика күніне орай өткен салтанатты жиында сөйлеген сөзінде еліміздің егемендігі туралы декларация қабылданған бұл күнді қасиетті тәуелсіздігіміздің бастауы деп баға берген болатын ұлттық мерекені республика бойынша ресми түрде атап өту осы салтанатты шарадан басталды сонымен қатар қазақстанның барлық өңірінде мемлекеттік ту көтеру рәсімі өтеді,"""['мақтаныш', 'таңқалу']"""
талғардағы уақытша ұстау изоляторынан қашып кеткен күдікті ұсталды алматы облысында талғардағы уақытша ұстау изоляторынан бірнеше күн бұрын қашып кеткен күдікті ұсталды бұл туралы облыстық полиция департаментіне сілтеме жасаған kaznurkz хабарлайды полиция департаментінің хабарлауынша жеделіздестіру шараларының нәтижесінде тереңқара ауылының шетінде қазан күні уақытша ұстау изоляторынан қашып кеткен ер адам ұсталды іздестіру жұмыстары басталған сәттен бастап полиция мен төтенше жағдайлар департаментінің барлық күштері жұмылдырылды сондайақ іздеу шараларына қоғамдық көмекшілер еріктілер мен облыс тұрғындары тарапынан құрылған ерікті жасақтар белсенді түрде атсалысты күдікті қайтадан уақытша ұстау изоляторына қамалды оған жасалған негізгі қылмысқа қосымша қамаудан қашқаны үшін айып тағылады полиция іздеу шараларына қолдау көрсеткен барлық азаматтарға алғыс білдіреді деді полиция өкілдері еске салайық бұған дейін алматы облысының полиция департаменті талғардағы уақытша ұстау изоляторынан қашып кеткен зорлау бойынша күдіктінің жеке мәліметтерін жариялағанын хабарлаған едік алматы облысы полиция департаменті уақытша ұстау изоляторынан қашып кеткен жылы туылған бекарыс сәбитұлы қалмырзаевқа іздеу салды уақытша ұстау изоляторынан зорлау жасады деген күдікпен қамауда отырған азаматтың қашып кеткеніне байланысты сирена жоспары енгізілді негізгі жолдарға блокбекеттер қойылып қашқынды іздеп табу және ұстау үшін барлық күш пен құралдар жұмылдырылды,"""['уайым', 'қайғы', 'таңқалу']"""
қасымжомарт тоқаев ел тұрғындарын республика күнімен құттықтады мемлекет басшысы қасымжомарт тоқаевтың республика күнімен құттықтауы жарияланды бұл туралы ақорда хабарлады құрметті отандастар баршаңызды республика күнімен шын жүректен құттықтаймын қазақстанның егеменді ел екенін әйгілейтін ұлық мейрам сан ғасырлық тарихы бар мемлекеттілігіміздің қайта жаңғыруының символы ұлттық мереке халқымызды мызғымас құндылықтар төңірегіне тоғыстырып жалпыұлттық бірегейлігімізді нығайта түсуге ықпал етеді біз берекелі бірлік пен ырысты ынтымақтың арқасында аса күрделі сынқатерлерді еңсеріп ауқымды өзгерістерді жүзеге асырып келеміз қоғамдағы заң мен тәртіп азаматтардың еңбекқорлығы мен кәсіби біліктілігі қазіргі реформалардың берік тірегіне әрі қозғаушы күшіне айналды біз болашаққа нық сеніммен қарап әділетті қазақстанды құру жолында нақты қадамдар жасай береміз еліміздің ертеңі қандай болатыны әрбір отандасымызға байланысты екені анық азаматтарымыз осы қастерлі жауапкершілікті терең түсініп мемлекеттігімізді нығайтуға өз үлесін қосады деп сенемін сіздерге зор денсаулық толайым табыс және бақбереке тілеймін делінген президент құттықтауында,"""['қуаныш', 'мақтаныш', 'таңқалу']"""
уефа конференция лигасы астана екінші ойында жеңіліс тапты бүгін қазанда астана футбол клубы уефа конференция лигасы аясындағы екінші ойынын өткізді бұл туралы kaznurkz хабарлайды бүгін елордалық астана футбол клубы уефа конференция лигасы аясында уэльстің ньюсейнтс командасына қарсы ойын өткізіп астаналық клуб есебімен жеңіліс тапты ньюсейнтс сапынан ойынның минутында рори холден гол соқты ал матчтың минутында мак манус есепті еселеді қыркүйекте астана футбол клубы уефа конференция лигасы аясында алматыда сербиялық тсц бачкатопола командасына қарсы ойын өткізіп есебімен жеңіске жеткен еді айта кетейік астана уефа конференция лигасының топтық кезеңінде қарашада пафоспен кипр қарашада виториямен португалия желтоқсанда челсимен англия желтоқсанда апоэлмен кипр ойнайды,"""['қайғы']"""
алина ертөстік күрестен жастар арасындағы әлем чемпионатын жүлдесіз аяқтады күрестен қазақстан құрамасының мүшесі алина ертөстік тиранада албания өтіп жатқан жасқа дейінгі жастар арасындағы әлем чемпионатында қола жүлде үшін белдесуінде жеңіліс тапты бұл туралы kaznurkz хабарлайды алина ертөстік кг дейінгі салмақта қола медаль үшін өткен белдесуде жапония өкілі нодока ямаматомен кездесті жастағы қазақстандық балуан қыз алина ертқстік қарсыласынан есебімен мерзімінен бұрын жеңіліп қалды сондайақ бұл бәсекеде кг дейінгі салмақта сынға түскен лаура ғаниқызы қола медаль үшін белдесуде жеңіліс тапты айта кетейік қазіргі уақытта жастар арасындағы әлем чемпионатында қазақстанның бірдебір спортшы медаль еншілей алмады ертең қазанда өтетін жарысқа қазақстандық еркін күрес шеберлері қатысады,"""['қайғы']"""
қазақстандық балуан қыз әлем чемпионатының қола жүлде үшін белдесуінде жеңіліс тапты күрестен қазақстан құрамасының мүшесі лаура ғаниқызы тиранада албания өтіп жатқан жасқа дейінгі жастар арасындағы әлем чемпионатында қола жүлде үшін белдесуінде жеңіліс тапты бұл туралы kaznurkz хабарлайды лаура ғаниқызы кг дейінгі салмақта қола медаль үшін өткен белдесуде жапония өкілі уми итомен кездесті жастағы қазақстандық балуан қыз қарсыласынан есебімен мерзімінен бұрын жеңіліп қалды бұл салмақтағы алтын медальді финалда америкалық сейдж мортимерден басым түскен ресейлік наталья пудова жеңіп алды айта кетейік қазіргі уақытта жастар арасындағы әлем чемпионатында қазақстанның бірдебір спортшы медаль еншілей алмады ертең қазанда өтетін жарысқа қазақстандық еркін күрес шеберлері қатысады,"""['қайғы']"""
шымкентте екі баласы бар отбасы газдан уланып өлім құша жаздады шымкенттегі пәтерлердің бірінде көмірқышқыл газынан уланған отбасы өлім құша жаздады оларды кездейсоқ өтіп бара жатқан пәтер иесі құтқарып қалған деп хабарлайды ктк телеарнасының сайты екі баласы бар ерлізайыптылар пәтер жалдап тұрған пәтердің иесінің айтуынша ол отбасының жағдайын білу үшін үйге кірмекші болған алайда есікті қаққанда ешкім ашпай қойған сол кезде ол пәтерді өз кілтімен ашты үйге кіргенде ол естүссіз жатқан екі баланы және анасын байқаған оқиға орнында слесарь болған дүрбелең басталды осы кезде қызметкер ермахан пәтерге кірді ол бәрін тыныштандырды біз терезелерді аша бастадық ол бірден өзінің барлық термометрлерін алып тексере бастады газды жауып тастады улану бар екенін айтты дейді пәтер иесі бағдат отбасы құтқарылды оқиғаның себебі газ бағанасы болды бұл газ колонкасы газды өткізе бастады дұрыс қолданылмаған болуы мүмкін назар аударыңыз ол шкафта тұр бірақ ашық жерде тұруы керек еді біз үнемі ескертулер жібереміз бірақ адамдар назар аудармайды дейді qazaqgaz aimaq ақ шымкент өндірістік филиалының апаттықдиспетчерлік қызметінің слесарі ермахан манқараев дереккөз ктк,"""['уайым', 'уайым', 'таңқалу']"""
путин ресейдегі кхдр әскерилері туралы ақпаратқа алғаш рет түсініктеме берді ресей президенті владимир путин өз елінің аумағында солтүстік кореядан келген әскерилер бар деген ақпаратқа қатысты пікір білдірді деп хабарлайды интерфаксқа сілтеме жасаған kaznurkz путин сұраққа жауап бере отырып кхдрмен стратегиялық серіктестік туралы келісімді еске салды бүгін менің ойымша біздің стратегиялық әріптестік туралы шарт ратификацияланды ол жерде бап бар біз солтүстік корея басшылығы біздің келісімдерімізге байыпты қарайтынына ешқашан күмәнданбадық осы мақала аясында нені және қалай істейтініміз бұл біздің ісіміз деді ол путин сондайақ ресей аумағында солтүстік корея әскерилерінің болуы туралы ақпаратқа түсініктеме берді бұған дейін спутниктік суреттер пайда болған еді суреттер маңызды нәрсе егер суреттер бар болса ол бір нәрсені бейнелейді дегенді білдіреді мен сіздердің назарыңызды украинадағы шиеленіске ресейдің әрекеттері емес ең алдымен ақш қолдаған жылғы мемлекеттік төңкеріс әкелгеніне аударғым келеді дейді ресей федерациясының президенті,"""['уайым', 'таңқалу']"""
бурабайдағы автотұрақтардың бірі ақылы болады бурабай курорттық аймағындағы абылай хан саябағындағы автотұрақ қарашадан бастап төленеді cондайақ тегін автотұрақ та жұмыс істейді деп жазады burabay damu басылымына сілтеме жасаған kaznurkz осылайша барлық көліктер үшін тұрақтағы алғашқы минут тегін болады одан кейін әр сағат үшін құны теңгені құрайды автотұрақ тәулік бойы жұмыс істейтін болады бұл ретте аумақта тегін тұрақ бар burabay damu сайтында жарияланған ақпаратқа сәйкес туристер өз көліктерін мультимедиялық кешеннің жанындағы автотұрақта ұзақ уақыт қалдырып айналасында табиғи автотұрақтар құра бастады бұл атап өткендей қозғалысты тежейді және басқа демалушыларға қолайсыздық тудырады осыған байланысты ақылы автотұрақ енгізу туралы шешім қабылданды оның құрылысына бюджет қаражаты игерілмеді автотұрақтан түскен барлық қаражат демалыс орны мен абылай хан алқабының аумағын дамытуға жұмсалады,"""['уайым', 'нейтрал']"""
жұма күні қазақстанның кей жерлерінде жаңбыр мен қар жауады ертең қазанда қазақстанның бірқатар аймақтарында қолайсыз ауа райы сақталады осыған байланысты жүргізушілерге ескерту жасалды деп хабарлайды қазавтожолға сілтеме жасаған kaznurkz қазанда ақмола ақтөбе павлодар солтүстік қазақстан қарағанды қызылорда қостанай маңғыстау облыстарында сондайақ ұлытау облысында кей жерлерде жаңбыр жауады деп хабарлайды telegramдағы қазавтожол арнасы абай шығыс қазақстан облыстарында жаңбыр жауады қар жауады осыған байланысты қазақстандық жүргізушілерге жол қауіпсіздігі ережелерін сақтауға кеңес берілді қазан аралығында қазақстанның басым бөлігінде тұрақсыз ауа райы сақталады қар аралас жаңбыр жауады деп күтілуде сондайақ желдің күшеюі тұман және көктайғақ болады деп болжануда,"""['уайым', 'уайым']"""
