text,emotions
қазақстанда байқоңырға рейстер ашылады қазақстан ресеймен байқоңырға әуе қатынасын орнатуға келісті мақсат ғарыш стансасына туризмді дамыту деп хабарлайды азаматтық авиация комитетіне сілтеме жасаған kaznurkz telegramдағы кга арнасында пайда болған ақпаратқа сәйкес талғат ластаев бастаған қазақстандық делегация ресей көлік министрінің орынбасары владимир потешкинмен кездескен ғарыш стансасына туризмді дамыту мақсатында қазақстан мен ресейден байқоңырға әуе қатынасын орнату туралы келісімге қол жеткізілді делінген хабарламада қала әкімшілігінің ресми сайтындағы ақпаратқа сәйкес байқоңыр жалға алу жағдайында жұмыс істейтін қазақстанның әкімшілікаумақтық бірлігі бұл байқоңыр кешенінің әлеуметтікмәдени және әкімшілік орталығы оның қолданыстағы инфрақұрылымы ресейдің ғарыш саласын дамыту бойынша алға қойған міндеттерін орындауды қамтамасыз етеді жылдың қаңтарында елдер арасында келісімге қол қойылып оған сәйкес байқоңырды жалға алу мерзімі жылға дейін ұзартылды,"""['қуаныш', 'таңқалу']"""
алматылықтар алма бақтарынан айырылуы мүмкін екенін мәлімдеді жағдайды мемлекеттік мекеме түсіндірді алматы тұрғындары апорт өсірілетін алма бақтарынан айырылуы мүмкін екенін мәлімдеді алматының жер ресурстарын басқару департаментінің өкілдері жағдайға түсініктеме берді деп хабарлайды kaznurkz instagram дағы парақшалардың бірінде видео жарияланды онда адамдар тобы алматы прокуратурасы халықаралық клубтар қауымдастығы жшснің жылдан бері иелік етіп келе жатқан жер учаскелеріне меншік құқығын жарамсыз деп тану туралы экономикалық сотқа талап арыз бергенін мәлімдейді учаскелерде айналымда ғимараттар жоқ бірақ алматы апорты өсіріледі сонымен қатар алматы қаласының жер ресурстарын басқару департаментінің өкілдері ауыл шаруашылығы министрлігіне қарасты халықаралық клубтар қауымдастығы жшс жылы қарасай ауданындағы гектар жерге тауарлық ауыл шаруашылығын жүргізуге меншік құқығын алғанын айтты ауданның бір бөлігі кейінірек қала шегіне кірген меншік құқығы аудан әкімінің шешімімен және үлгілік сатып алусату шартымен берілді деп хабарлады департаменттегілер жылы учаске бөліну туралы қорытынды мен жер қатынастары басқармасының бұйрығы негізінде жаңа кадастрлық нөмірлері бар учаскеге бөлінді бұл жер учаскесі арқылы керенқұлақ өзені мен беркара өзені ағып жатқанын атап өту маңызды жер кодексінің және баптарына сәйкес жылы қолданыста болған су қорының жерлері мемлекеттік меншік саналады және тиісті органдардың келісімімен уақытша пайдалануға ғана берілуі мүмкін деді департаменттегілер осыған байланысты ведомствода аталған жерлерді беру кезінде қарасай ауданының жергілікті атқарушы органы су айдындары алып жатқан жерлерді беруге тыйым салу бөлігінде жер заңнамасының нормаларын ескермеген деп есептеледі департамент өкілдері алматы прокуратурасы халықаралық клубтар қауымдастығы жшс мен қарасай ауданы әкімінің аппаратына мәмілені жарамсыз деп тану туралы талап арыз бергенін растады осы жылдың қазанында алматы қаласының мамандандырылған ауданаралық экономикалық соты талапарызды өндіріске қабылдады мемлекеттік органдардың жеке заңды және лауазымды тұлғалардың қазақстанның жер заңнамасын сақтауын қамтамасыз ету жер заңнамасының міндеттерінің бірі болып табылатындықтан республиканың нормативтікқұқықтық актілерінің барлық нормасын сақтау қажет деп санаймыз деп қорытындылады қаланың жер ресурстарын басқару департаменті өкілдері,"""['қайғы', 'қайғы', 'уайым']"""
базарда қарбыз тасығанмын шавкат рахмонов өзінің алғашқы табысы жайлы айтты ufc файтері шавкат рахмонов youtube желісіндегі naiza tv арнасына берген сұқбатында алғашқы табысы жайлы айтты бұл туралы kaznurkz хабарлайды ufcде өнер көрсететін қазақстандық жауынгер шавкат рахмонов алғашқы табысы базардағы жұмысы туралы айтты шавкат мақсатына жету үшін сол шақта еңбек пен сабырдың маңызын түсінген айтады алғашқы табысымды базарда қарбыз тасып алған едім сол кезде маған тиынтебен төлейтін алайда сол шақтың өзінде мен табыстың қадірін ұға бастадым деді шавкат рахмонов сондайақ шавкат кейбір талантты адамдардың өз мүмкіндіктерін толық пайдаланбай жатқанына қынжылатынын жасырмады кейбір адамдардың бойында зор потенциал бар бірақ олар мақсатқа жету үшін жұмыс істеуден бас тартады бұл мені әрдайым қынжылтатын мәселе деді шавкат рахмонов айта кетейік шавкат рахмонов желтоқсанда ақштың ласвегас қаласында ufc турнирінде жартылай орта салмақтағы чемпионы белал мухаммадқа қарсы кездесу өткізеді бұл жекпежек шавкат рахмонов үшін ufcдегі жетінші кездесуі болмақ,"""['қуаныш', 'уайым']"""
жихадқа шақырған шымкентте терроризмді насихаттаған азамат жылға сотталды шымкентте терроризмді насихаттаған ер адам сотталды сотталушы экстремистік әрекеттерін ұйымдастыру мақсатында әлеуметтік желіде адамдарды азғырып көндірген деп жазады otyrarkz басылым мәліметінше сотталушы террористік және экстремистік әрекеттерді ұйымдастыру мақсатында адамдарды жихадқа шақырған ол қылмыстық кодекстің бабы бөлігі бабы бөлігі бойынша айыпталды сотталушының кінәсі іс бойынша жинақталған құжаттар арқылы дәлелденген нәтижесінде ол жылға бас бостандығынан айырылды сот сотталушының жасаған қылмыстық құқық бұзушылықтарының ауырлығын әлеуметтік мәнін жеңілдететін мәнжайлар ретінде оның кінәсін толық мойындауын істеген ісәрекетіне шынайы өкініш білдіргенін ескере отырып тек бас бостандығынан айыру жазасын тағайындады сот оған түпкілікті баптың бөлігі баптың бөлігі негізінде жыл мерзімге бас бостандығынан айыру жазасын тағайындады деп мәлімдеді шымкент қалалық сотының баспасөз қызметі үкім әлі заңды күшіне енген жоқ,"""['қайғы']"""
геннадий головкин олимпиада комитеттерінің бас ассамблеясына қатысты қазақстан ұок басшысы геннадий головкин ұлттық олимпиада комитеттері қауымдастығының ұокқ бас ассамблеясына барды бұл туралы kaznurkz ұокның ресми сайтына сілтеме жасап хабарлайды бас ассемблея португалияның кашкайш қаласында өтіп жатыр оған әлемнің түкпіртүкпіріндегі олимпиадалық қозғалыстың ұйымы оның ішінде ұок халықаралық олимпиадалық комитет делегаттары халықаралық федерациялар мен олимпиада ойындарын ұйымдастыру комиттеттерінің өкілдері жиналған қазақстан атынан бас ассамблеяға ұлттық олимпиада комитеті президенті геннадий головкин мен ұок бас хатшысы әлімжан ақаев барды ұокқ бас ассамблеясының мақсаты тікелей диалог арқылы сессияға қатысушылар арасындағы ынтымақтастықты нығайту үшін мүмкіндіктер ұсыну болып саналады сессия аясында геннадий головкин біріккен күрес әлемі uww басшысы ненад лаловичпен халықаралық гимнастика федерациясы президенті fig моринари ватанабэмен халықаралық ауыр атлетика федерациясын iwf басқаратын мохаммед джалудпен сонымен бірге түркия франция ұлттық олимпиада комитеттері президенттерімен және өзге ұок өкілдерімен кездесті,"""['мақтаныш']"""
дүниеге ұл бала келсе қуанған кәрістер балаларын қалай тәрбиелейді кәріс халқы өскелең ұрпақ пен бала тәрбиесіне ерекше мән береді осы орайда ұлттық құндылықтарды бала күнінен бойға сіңіретін кәріс халқының бүлдіршіндерді тәрбиелеуде қандай ерекшеліктері болуы мүмкін бүгінгі материалдан біле аласыздар маңызды тұстар бұл мәтін автоматты түрде жи көмегімен жазылған және редактор тексермеген сондықтан фактологиялық және грамматикалық қателер болуы мүмкін толығырақ жарияланымда этнопедиатрия әр елдің бала тәрбиесіндегі ерекшеліктерін зерттейтін жас ғылым саласы кәріс отбасыларында бұрын ұл балаларға басымдық берілсе қазір қыз балаларды да жоғары бағалайды кәрістер балаларын еңбекқорлыққа білімге ұмтылуға отбасына адал болуға тәрбиелейді және ұлттық құндылықтарды дәріптейді мазмұны этнопедиатрия дегеніміз не ұл немесе қыз кәріс отбасыларында кімді көп күтеді кәріс отбасыларындағы бала тәрбиелеу ерекшеліктері еңбекқорлық кәрістердің бала тәрбиесіндегі басым бағыт этнопедиатрия дегеніміз не бала тәрбиелеуде әр елдің өзіндік ерекшелігі болады ғылымда әр мемлекеттің салтдәстүрі мен әдетғұрпын ұлттық құндылықтарын зерттейтін ілімді этнопедиатрия деп атайды екен massagetkz сайты ұсынған мәліметтерге сай этнопедиатрия ғылымы жас әрі көп зерттеуді талап ететін көрінеді бала тәрбиесі ұлт таңдамайды тәрбие барлық ұлтқа қызмет етеді алайда әр елдің балаларының бала тәрбиелеу ісі бірбіріне ұқсай бермейді әр ұлттың тәрбие беруі әрқилы болса да бала атаулыға бірдей нәрселер қажет олар туған отбасы ұядай жылы үй атаанасының қамқорлығы мен сүйіспеншілігі бала тәрбиесiндегi әр елдiң өзiндiк ерекшелiктерiн оқытатын ғылым бар оны этнопедиатрия деп атайды жас ғылым саласы деуге де болады деп жазылған мақалада этнопедиатрия жайлы сөз қозғағанда кәріс халқының өскелең ұрпақты тәрбиеулеудегі ерекшеліктеріне тоқталмау мүмкін емес осы орайда кәрістердің бала тәрбиеулеудегі ерекшеліктеріне тоқталып өтсек ұл немесе қыз кәріс отбасыларында кімді көп күтеді азияның көптеген еліндегідей кәріс отбасыларында да ұлдарға басымдық берілген екен кәрістер де ұлды бүтін бір әулеттің жалғастырушысы соңынан қалған тұяқ деп қабылдайды екен коре сарам басылымының хабарлауынша аталған елде әлі күнге дейін дәрігерлер болашақ баланың жынысын атаанасына айтпайды екен себебі көптеген жас отбасы сәбидің қыз болатынын естісе түсік жасататын көрінеді басылымның мәліметінше мұндай үрдіс әсіресе осыдан жыл бұрын ерекше белең алған тіпті автор осыдан бірнеше жыл бұрын кәріс отбасының фотосуретіне көз түскенін айтады онда ол ортада әулет басшысы ақсақалдан бастап оның жеті ұлы сонымен бірге жеті келіні мен олардың алдындағы ұл бүлдіршіндерге көзі түскені айтылады себебі бүлдіршіндердің шалбарының ауы әдейі тесілген көрінеді осы арқылы егде жастағы кәрістер өзгелерге әулеттерінде тек ұлдар екенін әрі отбасының жалғасы болатынын мақтанмен көрсеткен екен десе де уақыт өте келе аталған культ өзгеріске ұшыраған бүгінде корея мемлекетінде көптеген жас отбасылар керісінше қыздардың дүниеге келуін асыға күтеді екен мұның өзі қаржылық қажеттіліктерден туындады дейді мамандар себебі кәріс халқы ұлдарға бәсекеге қабілетті бола алатындай білім беріп отбасын асырай алатындай етіп өсіруге тырысады ал бұл өз кезегінде көп шығынды талап етеді бұл дегеніміз жыл бойы ұлдарға инвестиция құюмен пара пар болады қыздарға қатысты жағдай мүлдем басқаша оларға туғаннан бастап мұндай жауапкершілік жүктелмейді дегенмен кей отбасылар қыздарына да барынша көңіл бөліп болашақта күйеуінен қаржылай тәуелсіз болуы үшін бар жағдайды жасайды деп жазылған басылымда кәріс отбасыларындағы бала тәрбиелеу ерекшеліктері кәріс отбасылары балаларды қаталдықпен бірге бетінен қақпау қағидаттары бойынша өсіреді мәселен сәби кезінде бөбектерді отбасы мүшелерінен бастап тіпті көшедегі бейтаныс жандарға дейін еркелетуі мүмкін сонымен бірге кәріс жанұялары балаларға барлық қажеттіліктерді әперуге тырысады сол себепті сәбидің бөлмесі кейде ойын алаңына ұқсауы мүмкін деп жазады коре сарам порталы десе де бала өсе келе кәріс халқында бала тәрбиесі қаталдана түседі мысалы бала мектеп бітірген соң шынайы ересек өмірмен бетпе бет келеді сондықтан кәріс халқының жастары өте ұқыпты әрі зерек болады екен өйткені оларды атааналары бала күнінен бастап осылай тәрбиелейтін көрінеді мамандардың айтуынша кәріс мектептеріндегі оқушылар мектеп бағдарламасынан бөлек қосымша сабақтарға көп уақыт жұмсайды тіпті кейде балада жүктеме шамадан тыс көп болады дейді мамандар бұл мәселені жергілікті кәріс бақ да жиі көтереді олардың пікірінше кәріс мектептерінде орта және жоғары сыныптарда өмірге еш қажетсіз әрі қайталама пәндер көп екен мұндай кәріс атааналары балаларды шамадан тыс жүктеме арқылы тым шаршатып денсаулығына нұқсан келтіретін көрінеді сонымен бірге кәріс халқы баланың бір жасын тойлауға баса мән береді бұл жөнінде massagetkz порталында жарыққа шыққан мақалада былай деп жазылады кәрістер балалардың өмірінің басталуын оның бір жасқа толу жасын есептейді осы кезден бастап қана бала толыққанды адам болып есептеледі балалардың әрқайсысының бір жасқа толуын міндетті түрде атап өту керек егер атап өтілмесе онда ержеткенде баланың үйлену тойын мерейтойын және тб тойларын атап өтуге болмайды сондықтан да атааналар балаларының бір жасын ерекше атап өтуге тырысады кәрістер үшін бала тәрбиесі сөз бен істегі адалдық мақсатқа жетудегі табандылық пен төзімділікке баулу сол сияқты кәріс отбасыларындағы балаларды тәрбиелеу ерекшеліктерін төмендегідей етіп жіктеуге болады балаларға ұлттық құндылықтарды дәріптеу кәрістер балабақшадан бастап кішкентай бүлдіршіндерді иіліп рахмет айтуды үйретеді осы арқылы олар бөбектерге үлкенге құрмет кішіге ізет тәлімін береді балаларға сіз деп айтқызып үйрету кәріс халқы бүлдіршіндердің өзіне бірбіріне сіз деп айтқызып үйретеді немесе отбасындағы балаларға бірбіріне аға әпке деп бауырмал етіп тәрбиелеуге тырысады балаларды ынталандыру үшін тәттілерді береді оңтүстік кореяда тәртіпке ерекше мән беріледі сол себепті балалар еркелеп айтқанды тыңдамай қойса немесе оларды ынталандыру үшін балабақшаларда тәттілерді жиі береді киімге көп мән бермейді кәріс ұлты балалардың киім кию үлгісіне көп мән бермейді олар үйдің үлкеніне бірнеше жасқа үлкен киім әперіп үйдегі одан кіші балаларға осы киімдерді кигізуі мүмкін балаларды кез келген жерде ұйықтауға үйретеді кәріс балалары шулы жерге қарамастан кішкентайынан тез ұйықтауға бейім келеді еңбекқорлық кәрістердің бала тәрбиесіндегі басым бағыт кәріс жанұялары балалары болашақта білімсіз әрі кедей өмір сүрмеуі үшін олардың біліміне баса мән береді сол себепті жастайынан еңбекқорлыққа баулиды осыған байланысты кәріс балалары мектеп бағдарламасынан бөлек үй шаруасына да бейім келеді өйткені ересектер оларды кішкентайынан көп жұмсап өмірге бейімделуге үйретеді сол сияқты кәріс отбасыларындағы балаларды тәрбиелеудегі тағы бір қағидат ол ұйымшыл әрі отбасы мүшелерін жақын тарту бұл жөнінде сарапшылар азиялық ұжымдастыру элементтеріне басымдық берілетінін айтады мәселен еуропалық отбасылар үшін отбасыңа адал болу жақындарыңа жәрдемдесу қағидалары жат болуы мүмкін ал кәрістер үшін бұл қалыпты жағдай тіпті өмірлік ұстанымдарының бірі дейді мамандар көргеніміздей кәріс халқы бала тәрбиесіне баса мән береді әсіресе жас ұрпаққа ұлттық құндылықтар мен еңбекқорлыққа баулу жағынан аталған ұлттан үйренетініміз әрине көп,"""['нейтрал', 'таңқалу']"""
