text,emotions
іргетасының құлау қаупі бар астанада кенесары хан ескерткіші жөнделеді астана қаласының мәдениет басқармасы тарихимәдени мұраны сақтау мақсатында жылдары есіл өзенінің жағасында орналасқан кенесары хан ескерткішін қайта жаңарту жоспарланғанын мәлім етті бұл туралы kaznurkz әкімдік баспасөз қызметіне сілтеме жасап хабарлайды ғылымитехникалық зерттеу нәтижелеріне сәйкес нысан апатты деп танылды нысан іргетасының құлау қаупі бар нысанды бөлшектеу биылғы қараша айында басталады нысанның өзі жаңартылғаннан кейін жылдың көктемінде орнына қойылады деп жоспарлануда делінген хабарамада әкімдік мәліметінше жаңарту келесідей жұмыстарды орындауды мыналарды қамтиды мүсінді бөлшектеу және оны кейіннен қалпына келтіру тұғырды және оған іргелес аумақты бөлшектеу бұрғылау үйіндісін орнату сондайақ құрылымды кейіннен монтаждау және тұғырды қаптау материалымен әрлеу,"""['мақтаныш', 'таңқалу']"""
тоқаевтың сынынан кейін спорт саласына жетекшілерді тағайындау схемасы өзгерді мемлекет басшысы қасымжомарт тоқаевтың сынынан кейін облыстық спорт басқармаларының басшылары туризм және спорт министрлігінен арнайы комиссиясы келісімімен тағайындалады бұл туралы kaznurkz ведомствоға сілтеме жасап хабарлайды өңірлік спорт басқармалары басшысын тағайындау туризм және спорт министрлігі жанынан құрылған комиссияның келісімімен жүзеге асады президент қасымжомарт тоқаевтың тапсырмасына сәйкес өңірлік спорт басқармаларының басшыларын тағайындау тәртібі өзгерді бұдан былай басқарма басшылығына ұсынылған үміткерлер туризм және спорт министрлігінің жанынан құрылған комиссияның келісімін алуы керек комиссия жұмысына министр ербол мырзабосынов жетекшілік етеді президент қасымжомарт тоқаев хххііі жазғы олимпиада жүлдегерлерімен кездесуінде әрбір өңір қандай спорт түрін дамыту керектігіне қатысты шешімді дербес қабылдайтынын сынға алған болатын осыған орай мемлекет басшысы спорт саласындағы барлық деңгейдегі басқару вертикалін қалпына келтіру жөнінде үкіметке нақты тапсырма берді комиссияның жұмысы барысында өңірлік спорт басқармалары басшылығына ұсынылған кандидаттар нақты талаптар бойынша бағаланады үміткерлердің саладағы тәжірибесі мен дамыту жоспары болуы сондайақ спорт ғылымының негізі мен менеджментін меңгергені ескеріледі кандидаттарды ұсынуды жергілікті атқарушы органдар және министрлік жүзеге асыра алады жергілікті атқарушы орган комиссияның оң қорытындысын алған кандидаттарды ғана тағайындайды,"""['нейтрал']"""
мәскеудің ұстанымы путин ядролық қауіпті тежеу жаттығуларын өткізді владимир путин бүгін стратегиялық ядролық қауіпті тежеу күштерінің жаттығуында болды ресей президенті ядролық қаруды қолдану туралы да ойын айтты риа новости мәліметінше мемлекет басшысы кремльдегі ахуал орталығында болды бүгін біз стратегиялық қауіпті тежеу күштерінің кезекті оқуын өткізіп жатырмыз баллистикалық және қанатты зымырандарды іс жүзінде ұшыру арқылы ядролық қаруды қолдануды бақылау бойынша лауазымды тұлғалардың әрекетін үйренеміз деді ол путиннің пікірінше ядролық қаруды қолдану елдің қауіпсіздігін қамтамасыз етудің төтенше шарасы болмақ ресей басшысы атап өткендей бұл мәскеудің ұстанымы ресей федерациясының басшысы сондайақ ядролық үштік ресейдің егемендігі мен қауіпсіздігінің сенімді кепілі болып қала беретінін оған стратегиялық тежеу мәселелерін шешуге сондайақ әлемдегі ядролық тепетеңдікті және күштер тепетеңдігін сақтауға мүмкіндік беретінін жеткізді біз жаңа қарулану бойынша жарысқа түспейтінімізді атап өтейін бірақ біз ядролық күштерді қажетті деңгейде сақтаймыз деді ресей басшысы оның айтуынша әлемде шиеленістің күшеюі және жаңа сыртқы қауіпқатерлердің пайда болуы үнемі дайын тұратын заманауи стратегиялық тежеу күштерінің болуының маңыздылығын көрсетеді,"""['уайым', 'уайым']"""
түркістан облысында көмірге деген қажеттілік мың тоннаға азайған түркістан облысындағы жылыту маусымы өңірдегі ауданда биыл қазан аралығында басталды қалған аудан қалаларда жылу маусымын қарашадан бастау жоспарланған бұл туралы түркістан облысы энергетика және тұрғын үйкоммуналдық шаруашылық басқармасы басшысының орынбасары роза сариева мәлімдеді деп жазады kaznurkz роза сариеваның айтуынша облыс көлемінде жылу энергия орталығы орталықтандырылған және автономды қазандық бар жалпы облыстағы көпқабатты тұрғын үй мен бюджеттік мекеме жылыту маусымына толықтай дайын қазіргі таңда кентау қаласындағы шақырымдық магистральды жылу желілеріндегі жөндеу жұмыстары толық аяқталды өңірдің көмір отынына қажеттілігі мың тонна елді мекендерді газдандыру жұмыстарының нәтижесінде қатты отынға тәуелділік өткен жылмен салыстырғанда мың тоннаға азайған облысқа көмір тасымалдаумен өңірлік оператор айналысады қазір көмір тұйықтарындағы көмір қоры мың тоннаны құрап отыр жалпы жағдай қалыпты көмір жоспарға сәйкес тасымалдануда аймақта көмірдің тонна бағасы теңге аралығында саудалануда сондайақ облысқа қажетті мың тонна әлеуметтік мазутты энергетика министрлігі тарапынан оператор мекемелері анықталып бағасы бекітілді тасымалдау жұмыстары бойынша тиісті жұмыстар атқарылуда қыркүйек қазан айларында өңірге тонна мазут тасымалданды деп келтірді сариеваның сөзін түркістан облысы өкқ instagramдағы ресми парақшасында,"""['нейтрал']"""
орал қаласы әкімінің орынбасары тағайындалды орал қаласы әкімінің өкімімен тапишев аслан нұрланұлы орал қаласы әкімінің орынбасары болып тағайындалды бұл туралы kaznurkz әкімдікке сілтеме жасап хабарлайды орал қаласы әкімінің өкімімен тапишев аслан нұрланұлы орал қаласы әкімінің орынбасары болып тағайындалды тапишев аслан нұрланұлы жылы батыс қазақстан облысында дүниеге келген білімі жоғары жәңгір атындағы батыс қазақстан аграрлықтехникалық университеті мен батыс қазақстан инженерлікгуманитарлық университетінің ветеринарлық медицина және құқықтану мамандықтары бойынша тәмамдаған еңбек жолын жасыл ел жастар еңбек жасақтарының республикалық штабы бқо филиалының басшысы қызметінен бастады бқо қоғамдық даму басқармасының жастар ресурстық орталығы кмм басшысы болып еңбек етті жылдан бастап батыс қазақстан облыстық азаматтық альянсы қауымдастығы заңды тұлғалар бірлестігінің президенті қызметін атқарды тапишев аслан нұрланұлы қалалық жұмыспен қамту және әлеуметтік бағдарламалар ішкі саясат мәдениет және тілдерді дамыту дене шынықтыру және спорт бөлімдерінің қызметіне жетекшілік ететін болады,"""['нейтрал']"""
түркістандық спортшылар пауэрлифтинг және күштік спорт түрлерінен әлем рекордын жаңартты қырғыз республикасының астанасы бішкек қаласында пауэрлифтинг және күштік спорт түрлерінен әлем чемпионаты өтті аталған турнирде кентау қаласының балуандары әлемдік рекордтарды жаңартып жүлделі орындарды иеленді деп хабарлайды kaznurkz спортшылардың жарқын жеңісіне қатысты ақпарат түркістан облысы өкқ instagramдағы парақшасында жарияланды өңірлік коммуникациялар қызметінің мәліметіне сәйкес кентаулық ділмұрат ташполатов алтын медаль жеңіп алып рет әлем рекордын жаңарту арқылы ең үздік спортшы атанған ал елнұр абдрахманов алтын медаль алып рет әлем рекордын жаңартқан одан бөлек абдықадыр абдрахманов алтын медаль жеңіп әлем рекордын жаңартты бұдан бөлек оразалы байдулла алтын руслан уалиев алтын даурен дәрібаев алтын медаль алған,"""['қуаныш', 'мақтаныш', 'таңқалу']"""
уақыттың өзгеруі құрылысшылардың жұмысына әсер етті ме министр шарлапаев жауап берді үкімет отырысында индустрия және құрылыс министрі қанат шарлапаев біртұтас уақыт белдеуінің енгізілуі құрылысшылардың жұмысына әсер ете ме жоқ па деген сұрақ қойылды бұл туралы kaznurkz тілшісі хабарлайды журналистер бірыңғай уақыт белдеуінің енгізілуіне байланысты құрылысшылардың жұмыс істейтін уақыты қысқарғанын атап өтті осыған байланысты қанат шарлапаевтан сала өкілдерінен шағым түсті ме деп сұрады бұл сұрақ басқа да министрліктерге қатысты ғой бұған беруім дұрыс емес деп есептеймін біз құрылыс саласының өкілдерімен құрылысшылармен үнемі байланыстамыз сіз айтақна сұрақ бойынша шағым түспеді деп сендірді министр жақында қазақстанда сағат белдеуі туралы жаңа петиция пайда болды авторлар кейбір аймақтарда уақытты екі сағатқа алға жылжытуды ұсынып отыр еске салсақ биыл наурызда қазақстан бірыңғай utc уақыт белдеуіне ресми түрде ауысты еліміздің бірнеше өңірінде уақыт бір сағатқа артқа жылжыды атап айтқанда астана алматы шымкент қалаларында ақмола алматы жамбыл қарағанды қостанай павлодар солтүстік қазақстан түркістан шығыс қазақстан абай жетісу ұлытау облыстарында жергілікті уақыт бір сағатқа артқа қойылды бұған дейін тамызда астанада бірыңғай уақыт белдеуіне қарсы петиция бойынша шешімнің жобасын қоғамдық талқылау өтетіні хабарланған еді,"""['уайым', 'қайғы', 'нейтрал']"""
түркістан облысы көпбалалы отбасылардың саны бойынша республикада көш бастап тұр түркістан облысы көпбалалы отбасылардың саны бойынша республикада көш бастап тұр бұл жайында халықты әлеуметтік қорғау саласындағы реттеу және бақылау комитетінің түркістан облысы бойынша департамент басшысы бегман нұрмаханов брифингте мәлімдеді деп жазады kaznurkz бегман нұрмахановтың брифингте сөйлеген сөзі түркістан облысы өңірлік коммуникациялар қызметінің instagramдағы парақшасында жарияланды нұрмахановтың айтуынша өңірде жалпы зейнеткер бар оның ішінде азамат жасына байланысты зейнетақы алушы болса і базалық зейнетақы алушы сонымен қатар өңірдің азаматы жәрдемақы алушылар қатарында түркістан облысы елімізде көпбалалы отбасылар көптігінен көш бастап тұр бүгінгі таңда өңірде көпбалалы отбасы жәрдемақы алады сондайақ көпбалалы анаға департамент жәрдемақы белгілеген бұдан бөлек облыс тұрғыны мүгедектігі бойынша жәрдемақы алса азамат асыраушысынан айрылу себебінен мемлекеттік жәрдемақы алады деді ол брифингте сонымен қатар департамент басшысы медициналықәлеуметтік сараптама жүргізу жұмыстарына тоқталды статистикалық мәліметтерге сәйкес жылдың қазан айындағы көрсеткіш бойынша облыста мүгедектігі бар адамдардың саны ға жетіп республикадағы жалпы мүгедектер санының н құраған мүгедектігі бар адамдардың ы кәмелет жасына толмағандар болса қалған і жастан асқан облыс тұрғындары жыл басынан бері департамент тарапынан мүгедектігі бар адамдарды әлеуметтік қорғау саласындағы мемлекеттік бақылауды жүзеге асыру бойынша барлығы тексеру жұмыстары жүргізілген тексеру қорытындысымен нұсқама беріліп жалпы нысанға млн мың теңге көлемінде әкімшілік айыппұл салынған оның млн мың теңгесі өндірілген,"""['қуаныш', 'нейтрал']"""
қазақстандағы инватакси қызмет сапасының артуына не себеп қазақстанда қанша инватакси жұмыс істейді және еңбек және халықты әлеуметтік қорғау министрлігінің пилоттық жобасының көрсеткен нәтижелері туралы nurkz материалынан оқыңыздар инватакси қызметі мүгедек арбасымен ғана қозғала алаxadтын және жеке көмекші қызметімен қамxadтуға мұқтаж жүріптұруы қиын мүгедектігі бар адамдарды қолдаудың қосымша шарасы ретінде енгізілді инватакси мемлекеттік сатып алу туралы заңнамаға сәйкес мемлекеттік әлеуметтік тапсырыс арқылы әкімдіктермен көрсетіледі бүгінде автомобиль көлігімен мүгедектерді тасымалдау жөнінде қызметтер көрсету ережесімен инватакси қызметі реттеледі айта кету керек инватакси қызметі қазақстанның барлық облыстарында жергілікті бюджет есебінен жұмыс істейді қазір республика бойынша инватакси қызметі көрсетіліп мыңға жуық адам аталған қызметті пайдаланған сонымен қатар инватакси қызметінің сапасы мен көрсету жылдамдығын арттыру мақсатында еңбек және халықты әлеуметтік қорғау министрлігі қызметті көрсетуге қатысуға тиісті сұраныс алған такси агрегаторларын тарту бойынша пилоттық жобаға бастама жасалды яндекс компаниясы пилоттық жобаға қатысуға ниет білдірген жалғыз ұйым аталған пилоттық жобаны іске асыру аясында жылы астана мен алматыда бұл қызмет түрі жанданды ағымдағы жылдың өткен кезеңінде астанада яндекс такси арқылы мыңнан астам ал алматыда мыңнан астам мүгедектігі бар адамдар инватакси қызметін пайдаланды еңбек және халықты әлеуметтік қорғау министрлігінің мәліметінше аталмыш жоба жақсы нәтиже көрсетуде атап айтқанда инватаксиге деген сұраныстың орындалуы қамтамасыз етілген қызмет алушылардың оң пікірлері такси сапасының айтарлықтай жақсарғанын дәлелдейді жолаушылар атап өткен басты артықшылықтың бірі такси қызметі кезкелген уақытта қол жетімді жобаның ерекшелігі қызметті алушы үшін көлікті тезірек таңдау онлайн режимінде тапсырыс мәртебесін қадағалау және сапарларды бақылаудың қарапайым жүйесінің болуы сондайақ көлік ең қысқа мерзімде минут жеткізіледі еңбек және халықты әлеуметтік қорғау министрлігінің хабарлауынша қызмет алушы әлеуметтік қызметтер порталы арқылы инватакси компаниясын өз бетінше таңдауға мүмкіндік беру мақсатында қолданыстағы заңнамаға тиісті өзгерістер енгізу мәселесі пилоттық жоба нәтижесі бойынша талданатын болады одан бөлек болашақта салауатты бәсекелестікті қалыптастыру үшін әлеуметтік қызметтер порталына басқа да такси агрегаторлары енгізілмекші министрлік әлеуметтік қызметтер порталына балама ретінде мемлекеттік сатып алу процессін қолданыстағы заңнамада қалдыру қажеттілігін ұсынғанын атап өтті бұның басты себебі шалғай елді мекендер мен ауылдарда такси агрегаторының қолданыстағы қызметтерін қолдану мүмкіндігінің шектеулілігі,"""['қуаныш', 'мақтаныш']"""
